{
  "$schema": "../../schemas/windows-agent-report.schema.json",
  "schemaVersion": "2.0.0",
  "recordedAt": "2026-10-14T22:44:46.148Z",
  "laboratory": {
    "version": "0.0.0",
    "sourceCommit": "fc00255179f467819a83d429a563abeafaa8d48f",
    "profileVersion": "2.0.0"
  },
  "execution": {
    "scope": "active-owner-authorized",
    "interface": "host-codex-mcp-ssh-windows-app",
    "rawOutputRetained": false,
    "graphicalSessionUsed": true,
    "aiAttemptLimitSeconds": 600,
    "resumedAfterTechnicalFailure": true,
    "aiEvidenceMode": "verified-consumed-attempt",
    "aiInferenceStartedInRun": false
  },
  "delivery": {
    "kind": "msix",
    "identity": "Rappor.RapporSecurity",
    "version": "1.0.0.19",
    "architecture": "x64",
    "sha256": "e48a765043a7bd1fef77989dc718df684a91acae0262f14fe70bbc04873cdd3a",
    "signatureStatus": "Valid",
    "sourceRevision": "e12005607d7c13137efd9c1e146d0ec8489ecf0a",
    "embeddedSourceRevision": "e12005607d7c13137efd9c1e146d0ec8489ecf0a",
    "sourceArchiveSha256": "53b75a60bde076af607a36d691f27464745ee6fe9e4e7164c3ceabb3a2afd8a5",
    "packageLength": 104441335,
    "sourceInputsMatchCurrent": true,
    "installedBaselinePreserved": true,
    "installedBaselineVersion": "1.0.0.17",
    "labVersionOverrideOnly": true,
    "laboratoryOnly": true,
    "semanticProductVersionChanged": false,
    "workspaceProtocolVersion": 1,
    "computerAvailable": true,
    "cleanMachineProven": false,
    "microsoftStoreCertified": false,
    "microsoftStoreSigned": false,
    "nativeArm64Proven": false,
    "buildContractSha256": "d6b9613e639aa7291516ebd33d5bb056b444b4e3133fddf696f512583a1f742f",
    "requiredPayloadSha256": "8ed7e08badb77935b3c481c7e306464cdf3ae9b219d61a91233840434da26c2f",
    "requiredPayloadCount": 7
  },
  "runtimeDelivery": {
    "protocolVersion": 7,
    "sourceRevision": "e29d96a0b46cd25cde6e3a9b022e177488e869df",
    "imageDigest": "sha256:0cf6d1ef378aa8ff72abb04d4f65b35c9ef0b078c04e0501ed701c09762dbce3",
    "currentWorkspaceReady": true
  },
  "aiEvidence": {
    "authorization": "issue-18-verified-flow-20261014",
    "resultSha256": "4d829f04ea71d4153184eabcc1d228bdd7881f34f084881384c124103bde2dfa",
    "verificationSha256": "eb23342d5bfce5a1e728a87effbf5f98485f3d953eb5d9e857b52d3219c25db5",
    "completedAt": "2026-10-14T20:24:39.015Z",
    "durationMs": 198000,
    "findingCount": 70,
    "securityScore": 19.958358398579,
    "scorePresentation": "PreciseDecimal",
    "scoreClassification": "Critical",
    "originalCleanupConfirmed": false,
    "finalCleanupVerified": true,
    "automaticReviewerApproved": true
  },
  "environment": {
    "hostArchitecture": "x64",
    "guestArchitecture": "x64",
    "baselineApplicationVersion": "1.0.0.17",
    "candidateApplicationVersion": "1.0.0.19",
    "powershellVersion": "5.1.26100.9711",
    "wsl2": true,
    "dockerDesktopVersion": "4.91.0.239619",
    "dockerVersion": "29.8.0",
    "linuxContainers": true
  },
  "preflight": {
    "vmAutostart": true,
    "headlessControl": true,
    "hostFreeGiB": 39.2,
    "guestFreeGiB": 14.7,
    "minimumHostFreeGiB": 20,
    "minimumGuestFreeGiB": 10,
    "overlayGiB": 53.1,
    "maximumOverlayGiB": 55,
    "maximumOverlayGrowthGiB": 2,
    "capacityFailureProved": true
  },
  "lifecycle": {
    "upgrade": {
      "passed": true,
      "durationMs": 232543
    },
    "idempotentReinstall": {
      "passed": true,
      "durationMs": 164897
    },
    "cleanInstall": {
      "passed": true,
      "durationMs": 141690
    },
    "sameComputerReused": true,
    "shutdownAndBoot": {
      "passed": true,
      "durationMs": 319681
    },
    "suspendAndResume": {
      "passed": true,
      "durationMs": 2407
    },
    "heartbeatOfflineOnline": {
      "passed": true,
      "durationMs": 319681
    },
    "credentialRotation": {
      "passed": true,
      "durationMs": 158152
    },
    "credentialRevocationRecovery": {
      "passed": true,
      "durationMs": 158152
    },
    "invalidConfigurationRecovery": {
      "passed": true,
      "durationMs": 36002
    }
  },
  "failures": [
    {
      "caseId": "docker-stopped",
      "failureClass": "docker-not-ready",
      "guidanceClass": "start-docker-and-retry",
      "recovered": true,
      "durationMs": 111526
    },
    {
      "caseId": "incompatible-architecture",
      "failureClass": "unsupported-architecture",
      "guidanceClass": "use-supported-64-bit-windows",
      "recovered": true,
      "durationMs": 24013
    },
    {
      "caseId": "missing-image",
      "failureClass": "image-unavailable",
      "guidanceClass": "publish-exact-image-and-retry",
      "recovered": true,
      "durationMs": 7142
    },
    {
      "caseId": "invalid-local-configuration",
      "failureClass": "configuration-invalid",
      "guidanceClass": "restore-valid-configuration-and-retry",
      "recovered": true,
      "durationMs": 36002
    },
    {
      "caseId": "expired-token",
      "failureClass": "credential-rejected",
      "guidanceClass": "rotate-credential-and-retry",
      "recovered": true,
      "durationMs": 158152
    }
  ],
  "analyses": [
    {
      "source": "public-repository",
      "status": "completed",
      "sourceRevision": "557c6040549034224aaeddaae07f83dce880bc46",
      "clientPath": "managed-hml",
      "scanners": [
        {
          "key": "semgrep",
          "version": "1.172.0",
          "state": "completed",
          "databaseState": null
        },
        {
          "key": "gitleaks",
          "version": "8.30.1",
          "state": "completed",
          "databaseState": null
        },
        {
          "key": "trivy",
          "version": "0.74.0",
          "state": "completed",
          "databaseState": "approved-offline-stale"
        }
      ],
      "durationMs": 30294
    },
    {
      "source": "local-synthetic-folder",
      "status": "completed",
      "sourceRevision": "sha256:e82f56fcedf62a69ea297b3d6e94a9f504d3c13b36b566b3e90820e57dfb9910",
      "clientPath": "host-codex-ssh-windows-app",
      "scanners": [
        {
          "key": "semgrep",
          "version": "1.172.0",
          "state": "completed",
          "databaseState": null
        },
        {
          "key": "gitleaks",
          "version": "8.30.1",
          "state": "completed",
          "databaseState": null
        },
        {
          "key": "trivy",
          "version": "0.74.0",
          "state": "completed",
          "databaseState": "approved-offline-stale"
        }
      ],
      "durationMs": 198000
    }
  ],
  "cleanup": {
    "computerRetained": true,
    "remoteRecordsArchived": true,
    "transientFilesRemoved": true,
    "controlledStatePreserved": true,
    "hostFreeGiB": 39.6,
    "guestFreeGiB": 15,
    "overlayGiB": 52.8,
    "overlayGrowthGiB": 0,
    "diskWithinLimits": true
  },
  "sanitization": {
    "retained": [
      "steps",
      "failure-classes",
      "versions",
      "architectures",
      "durations",
      "boolean-outcomes",
      "evidence-hashes",
      "finding-count",
      "security-score",
      "database-freshness"
    ],
    "excluded": [
      "credentials",
      "authorization-values",
      "computer-identifiers",
      "operation-identifiers",
      "personal-paths",
      "source-code",
      "raw-api-responses",
      "scanner-output",
      "setup-logs"
    ]
  }
}
